"Link","Title","Author","Time","Tag"
"https://cryptonews.com/news/tether-takes-5-2m-usdt-frozen-to-phishing-links.htm","Tether Takes Action: $5.2M in USDT Frozen Due to Phishing Links","Jimmy Aki","2024-05-14T17:03:39+00:00","Phishing scams Tether USDT"
"https://cryptonews.com/news/crypto-whales-gather-around-this-unlisted-meme-coin-next-100x-project.htm","Crypto Whales Gather Around This Unlisted Meme Coin – Next 100x Project?","Tim Hakki","2024-05-14T16:49:56+00:00","seal sealana Solana"
"https://cryptonews.com/exclusives/spencer-farrar-partner-at-theory-ventures-on-web3-venture-capital-funding-and-strategy-ep-334.htm","Spencer Farrar, Partner at Theory Ventures, on Web3 Venture Capital, Funding, and Strategy | Ep. 334","Sead Fadilpašić","2024-05-14T15:56:30+00:00","Investment Market Venture Capital"
"https://cryptonews.com/cryptocurrency/crypto-loans-without-collateral/","Crypto Loans Without Collateral - How Do They Work?","Eliman Dambell | Verified by Medb Kiely-Cuddy Medb Kiely-Cuddy","2024-05-14T15:19:19+00:00"
"https://cryptonews.com/news/blockdag-dominates-global-stage-piccadilly-circus-event-fuels-30-target-by-2030-dampens-floki-and-injectives-appeal.htm","BlockDAG Dominates Global Stage: Piccadilly Circus Event Fuels $30 Target by 2030, Dampens Floki and Injective's Appeal","Michael Graw | Verified by CryptoNews Editorial Team CryptoNews Editorial Team","2024-05-14T15:12:28+00:00"
"https://cryptonews.com/cryptocurrency/best-low-supply-crypto/","12 Best Low Supply Cryptocurrencies in 2024","Kane Pepi | Verified by CryptoNews Editorial Team CryptoNews Editorial Team","2024-05-14T14:40:22+00:00"
"https://cryptonews.com/news/crypto-exchange-listing-and-delisting-announcements-may-13-2024.htm","Crypto Exchange Listing and Delisting Announcements: May 13, 2024","","","Altcoin Exchange Trading"
"https://cryptonews.com/cryptocurrency/best-rwa-crypto/","12 Best Real World Assets (RWA) Coins to Invest in 2024","Kane Pepi | Verified by CryptoNews Editorial Team CryptoNews Editorial Team","2024-05-14T12:22:02+00:00"
"https://cryptonews.com/news/bitcoin-hash-rate-declines-as-mining-firms-shut-down-unprofitable-rigs-post-halving.htm","Bitcoin Hash Rate Declines as Mining Firms Shut Down Unprofitable Rigs Post-Halving","Ruholamin Haqshanas","2024-05-14T11:24:56+00:00","Bitcoin Bitcoin Mining"
"https://cryptonews.com/news/floki-rally-floki-price-up-8-as-meme-coins-bounce-back-is-this-ai-coin-next-to-pump.htm","Floki Rally: FLOKI Price Up 8% as Meme Coins Bounce Back – Is This AI Coin Next to Pump?","Tim Hakki","2024-05-14T11:15:16+00:00","Floki Meme Coins wienerai"
"https://cryptonews.com/news/crypto-news-today.htm","What’s Happening In Crypto Today? Daily Crypto News Digest","Sead Fadilpašić","2024-05-14T14:05:10+00:00","Best Crypto Bitcoin Crypto News"
"https://cryptonews.com/news/evolution-of-digital-art.htm","Evolution of Digital Art","Darla Wall","2024-05-14T09:36:33+00:00"
"https://cryptonews.com/news/why-this-rwa-project-is-set-to-revolutionize-the-way-you-fill-up-your-vehicles.htm","Why this RWA project is set to revolutionize the way you fill up your vehicles!","",""
"https://cryptonews.com/news/shutdown-partners-with-immutable-zkevm-to-bring-rogue-ai-shooter-game-shutdown-to-the-blockchain.htm","Shutdown Partners With Immutable zkEVM To Bring Rogue AI Shooter Game Shutdown To The Blockchain","",""
"https://cryptonews.com/news/animoca-brands-japan-to-release-fairy-tail-digital-collectibles.htm","Animoca Brands Japan and Quidd to Release 'FAIRY TAIL' Digital Collectibles","Hongji Feng","2024-05-14T08:46:51+00:00","Japan NFT"
"https://cryptonews.com/news/pink-piggy-gears-up-for-a-major-launch-as-presale-starts-with-a-bang.htm","Pink Piggy Gears Up for a Major Launch, as Presale Starts with a Bang","",""
"https://cryptonews.com/news/hong-kongs-new-spot-bitcoin-etfs-attract-investors-from-mainland-china.htm","Hong Kong's New Spot Bitcoin ETFs Attract Investors from Mainland China","Hongji Feng","2024-05-13T05:56:37+00:00","Bitcoin China Hong Kong"
"https://cryptonews.com/news/viabtc-the-long-term-believers-in-bitcoin.htm","ViaBTC: The Long-Term Believers in Bitcoin","",""
"https://cryptonews.com/news/how-chimpzees-nft-passports-are-revolutionizing-crypto-philanthropy.htm","How Chimpzee's NFT Passports are Revolutionizing Crypto Philanthropy","",""
"https://cryptonews.com/news/bitcoin-shows-signs-of-stagnation-but-insanity-bets-continues-to-pump.htm","Bitcoin Shows Signs of Stagnation, But Insanity Bets Continues to Pump","",""
"https://cryptonews.com/news/wall-street-giants-jpmorgans-onyx-eye-industrializing-blockchain-pocs.htm","Wall Street Giants, JPMorgan's Onyx Eye Industrializing Blockchain PoCs","Ruholamin Haqshanas","2024-05-12T16:00:24+00:00","Asset tokenization Tokenized Funds"
"https://cryptonews.com/news/shiba-inu-price-prediction-as-shib-spikes-up-1-7-in-24-hours-1-shib-possible-soon.htm","Shiba Inu Price Prediction as SHIB Spikes Up 1.7% in 24 Hours – $1 SHIB Possible Soon?","Arslan Butt","2024-05-12T15:42:32+00:00","Shiba inu Shiba Inu News"
"https://cryptonews.com/news/bitgert-coins-future-potential-a-deep-dive-into-its-growth-catalysts.htm","Bitgert Coin's Future Potential: A Deep Dive into Its Growth Catalysts","",""
"https://cryptonews.com/news/victim-recovers-funds-after-71-million-address-poisoning-attack-heres-what-happened.htm","Victim Recovers Funds After $71 Million 'Address Poisoning' Attack – Here's What Happened","Ruholamin Haqshanas","2024-05-12T08:00:18+00:00","Crypto hack crypto scam"
"https://cryptonews.com/news/crypto-casino-mania-insanity-bets-announces-1m-presale-jackpot.htm","Crypto Casino Mania: Insanity Bets Announces $1M Presale Jackpot","",""
"https://cryptonews.com/news/solana-price-prediction-as-ceo-yakovenko-previews-post-firedancer-era-is-sol-set-to-lead-in-web3.htm","Solana Price Prediction as CEO Yakovenko Previews Post-Firedancer Era – Is SOL Set to Lead in Web3?","Arslan Butt","2024-05-11T17:21:01+00:00","Solana Solana News"
"https://cryptonews.com/news/bitcoin-price-prediction-as-btc-hits-60k-after-feds-rate-cut-comments-whats-next.htm","Bitcoin Price Prediction as BTC Hits $60k After FED's Rate Cut Comments – What’s Next?","Arslan Butt","2024-05-11T15:32:23+00:00","Bitcoin bitcoin news"
"https://cryptonews.com/news/institutions-likely-to-show-interest-in-bitcoin-defi-applications.htm","Institutions Likely To Show Interest in Bitcoin DeFi Applications","Rachel Wolfson","2024-05-10T21:01:33+00:00","Bitcoin DeFi etherem"
"https://cryptonews.com/news/solanas-fully-baked-new-meme-coin-slothana-sloth-rises-107-in-24-hours-hits-new-ath-after-burn-mechanism-announcement.htm","Solana’s Fully Baked New Meme Coin Slothana ($SLOTH) Rises 107% in 24 Hours, Hits New ATH After Burn Mechanism Announcement","Tim Hakki","2024-05-10T19:30:32+00:00","sloth slothana Solana"
"https://cryptonews.com/news/white-house-plans-to-nominate-cftc-commissioner-for-treasury-position.htm","White House Plans to Nominate CFTC Commissioner Johnson for Treasury Position","Jimmy Aki","2024-05-10T18:46:48+00:00","CFTC Kristin Johnson White house"
"https://cryptonews.com/news/stand-with-crypto-launches-crypto-pac-ahead-of-2024-elections.htm","Stand With Crypto Launches PAC To Back Pro-Crypto Politicians Ahead of November Elections: Reuters","Julia Smith","2024-05-10T18:32:48+00:00","Donald Trump PAC SAB 121"
"https://cryptonews.com/news/best-crypto-to-buy-now-may-10-toncoin-render.htm","Best Crypto to Buy Now May 10 – Toncoin, Render","Joel Frank","2024-05-10T17:32:37+00:00","Best Crypto render toncoin"
"https://cryptonews.com/exclusives/eduard-jubany-tur-founder-of-zkx-on-perpetual-futures-defi-growth-in-asia-and-how-defi-can-democratize-finance-ep-333.htm","Eduard Jubany Tur, Founder of ZKX, on Perpetual Futures, DeFi Growth in Asia, and How DeFi Can Democratize Finance | Ep. 333","Sead Fadilpašić","2024-05-10T14:55:31+00:00","Asia DeFi Starknet"
"https://cryptonews.com/news/blastup-launchpad-raises-over-5-5m-in-presale-as-investors-flood-in.htm","BlastUP Launchpad Raises Over $5.5M in Presale as Investors Flood In","Medb Kiely-Cuddy","2024-05-10T14:36:42+00:00"
"https://cryptonews.com/news/franklin-templeton-praises-coinbase-incubated-base-layer-2-network-in-socialfi-cites-success-with-friend-tech.htm","Franklin Templeton Praises Base Network in SocialFi, Cites Success with Friend.Tech","Hassan Shittu","2024-05-10T14:23:16+00:00","Base Coinbase"
"https://cryptonews.com/news/wax-to-matic-time-to-swap.htm","WAX to MATIC: Time to Swap?","",""
"https://cryptonews.com/news/chaingpt-pad-launches-wisdomise-ai-ido-to-bring-inclusive-ai-powered-wealth-management-tools-to-web3.htm","ChainGPT Pad launches Wisdomise AI IDO to bring inclusive, AI-powered wealth management tools to Web3","",""
"https://cryptonews.com/news/blockdag-shiba-inu-and-fantom-assessing-the-most-promising-crypto-investment-for-2024.htm","BlockDAG, Shiba Inu, and Fantom: Assessing the Most Promising Crypto Investment for 2024","Michael Graw","2024-05-10T12:47:57+00:00"
"https://cryptonews.com/news/is-dogwifhat-dead-crypto-expert-tweets-1-price-target-new-meme-coin-wienerai-raises-1-4-million.htm","Is DogWifHat Dead? Crypto Expert Tweets $1 Price Target, New Meme Coin WienerAI Raises $1.4 Million","Tim Hakki","2024-05-10T12:45:16+00:00","DogWifHat wai wienerai"
"https://cryptonews.com/news/canaan-launches-new-miner-model-a1566-at-bitcoin-asia-2024.htm","Canaan Launches New Energy-Efficient Miner A1566 at Bitcoin Asia 2024","Hongji Feng","2024-05-10T08:59:57+00:00","Bitcoin Hong Kong Miner"
"https://cryptonews.com/news/uae-crypto-scene-friendlier-than-us-political-stability-komodo-cto.htm","UAE Offers Friendlier Crypto Scene Than US Due to Political Stability: Komodo CTO","Shalini Nagarajan","2024-05-10T08:52:20+00:00","Dubai UAE"
"https://cryptonews.com/news/arch-labs-7-million-to-develop-bitcoin-native-application-platform.htm","Arch Labs Raises $7 Million to Develop Bitcoin-Native Application Platform","Hongji Feng","2024-05-10T06:13:11+00:00","Bitcoin Blockchain"
"https://cryptonews.com/news/attacker-returns-153000-worth-of-ether-to-victim-after-stealing-68-million.htm","Attacker Returns $153,000 Worth of Ether to Victim After Stealing $68 Million","Hassan Shittu","2024-05-10T04:43:18+00:00","Address poisoning crypto scams"
"https://cryptonews.com/news/eclipse-labs-ceo-steps-down-following-sexual-misconduct-allegations.htm","Eclipse Labs CEO Steps Back Following Sexual Misconduct Allegations","Tanzeel Akhtar","2024-05-10T04:21:09+00:00","Eclipse Labs Ethereum Sexual Misconduct"
"https://cryptonews.com/news/marathon-digital-reports-facing-operational-challenges-in-q1-earnings.htm","Marathon Digital Reports Facing 'Operational Challenges' in Q1 Earnings","Tanzeel Akhtar","2024-05-10T04:01:32+00:00","Bitcoin Mining earnings Marathon Digital"
"https://cryptonews.com/news/gains-network-fork-bug.htm","Gains Network Fork Bug Allowed Traders To Profit 900% On Every Trade: Report","Andrew Throuvalas","2024-05-09T23:31:42+00:00","crypto scam DeFi"
"https://cryptonews.com/news/georgia-protests-are-funded-by-overseas-crypto-claims-security-service.htm","Georgia Protests ‘Are Funded by Overseas Crypto,’ Claims Security Service","Tim Alper","2024-05-09T23:30:19+00:00","funding Georgia"
"https://cryptonews.com/news/pepe-investors-shift-to-new-bitcoin-project-targeting-976-gains-within-months.htm","Pepe Investors Shift to New Bitcoin Project, Targeting 976% Gains Within Months","Joel Frank","2024-05-09T23:08:26+00:00","99bitcoins Bitcoin project Pepe"
"https://cryptonews.com/news/3-memecoins-identified-for-potential-1500-returns-in-mid-may-2024-expert-pinpoints-3-altcoins-for-potential-1500-returns-by-may-2024.htm","3 Memecoins Identified for Potential 1500% Returns in Mid-May 2024 Expert Pinpoints 3 Altcoins for Potential 1500% Returns by May 2024","",""
"https://cryptonews.com/news/ghana-merges-tradition-and-technology-with-nft-stamp-collection.htm","Ghana Merges Tradition and Technology with NFT Stamp Collection","Thomas Musgrave","2024-05-09T22:43:45+00:00","Africa NFT"
"https://cryptonews.com/news/ethereum-price-prediction-amidst-heavy-whale-purchases-will-eth-break-past-3000-soon.htm","Ethereum Price Prediction Amidst Heavy Whale Purchases – Will ETH Break Past $3,000 Soon?","Joel Frank","2024-05-09T22:22:03+00:00","ETH Ether Ethereum"
"https://cryptonews.com/news/these-5-memecoins-set-to-spearhead-market-recovery-which-memecoins-should-you-add-to-your-portfolio-by-may-2024.htm","These 5 Memecoins Set to Spearhead Market Recovery Which Memecoins Should You Add to Your Portfolio by May 2024?","",""
"https://cryptonews.com/news/nft-trader-loses-145k-to-bayc-phishing-scam.htm","NFT Trader Loses $145K To BAYC Phishing Scam","Jimmy Aki","2024-05-09T19:36:21+00:00","BAYC NFT Phishing scams"
"https://cryptonews.com/news/best-crypto-to-buy-now-may-9-arweave-render-toncoin.htm","Best Crypto to Buy Now May 9 – Arweave, Render, Toncoin","Joel Frank","2024-05-09T18:42:48+00:00","Best Crypto Bitcoin btc"
"https://cryptonews.com/news/ai-solutions-advance-real-world-asset-tokenization.htm","AI Solutions Seek To Advance Real World Asset Tokenization","Rachel Wolfson","2024-05-09T16:59:17+00:00","Real World Assets RWA Tokenization"
"https://cryptonews.com/news/ai-crypto-coin-rally-begins-ahead-of-nvidias-may-22-earnings-this-lesser-known-coin-poised-for-biggest-surge.htm","AI Crypto Coins Rally Begins Ahead of NVIDIA's May 22 Earnings, This Lesser-Known Coin Poised for Biggest Surge","Tim Hakki","2024-05-09T16:24:10+00:00","ai coins wai wienerai"
"https://cryptonews.com/news/3-reasons-why-rollblock-rblk-can-overtake-binance-coin-bnb-and-algorand-algo.htm","3 Reasons Why Rollblock (RBLK) Can Overtake Binance Coin (BNB) and Algorand (ALGO)","",""
"https://cryptonews.com/news/lightning-labs-bring-stablecoins-to-bitcoin.htm","Lightning Labs Paving the Way to Bring Stablecoins to Bitcoin","Harvey Hunter","2024-05-09T15:29:29+00:00","Bitcoin Lightning Network Stablecoins"
"https://cryptonews.com/news/chilliz-and-azuro-partner-to-tap-into-growing-onchain-sports-prediction-market.htm","Chilliz and Azuro Partner to Tap Into Growing Onchain Sports Prediction Market","Tanzeel Akhtar","2024-05-09T15:00:25+00:00","Azuro Chiliz Sport"
"https://cryptonews.com/news/marsh-introduces-insurance-solution-for-eu-crypto-asset-service-providers.htm","Marsh Introduces Insurance Solution for EU Crypto-Asset Service Providers","Ruholamin Haqshanas","2024-05-09T14:14:51+00:00","Crypto Assets MiCA"
"https://cryptonews.com/news/blockdaemon-expands-into-eth-liquid-staking-market.htm","Blockchain Infrastructure Firm Blockdaemon Expands into ETH Liquid Staking Market","Tanzeel Akhtar","2024-05-09T14:00:23+00:00","Blockchain Blockdaemon Ethereum staking"
"https://cryptonews.com/news/bitcoin-bull-allocates-funds-to-ethereum-alternative-priced-under-0-01.htm","Bitcoin Bull Allocates Funds to Ethereum Alternative Priced Under $0.01","",""
"https://cryptonews.com/news/near-protocol-recent-cryptic-x-posts-raise-hack-suspicions.htm","Cryptic NEAR Protocol X Posts Raise Hack Suspicions","Harvey Hunter","2024-05-09T12:20:26+00:00","Hack NEAR protocol Twitter Hack"
"https://cryptonews.com/news/pantera-capital-joins-bullish-bitcoin-forecasts-predicts-price-surge-to-114000-by-2025.htm","Pantera Capital Joins Bullish Bitcoin Forecasts, Predicts Price Surge to $114,000 by 2025","Ruholamin Haqshanas","2024-05-09T12:10:18+00:00","Bitcoin Pantera Capital"
"https://cryptonews.com/news/trader-who-predicted-bitcoins-2024-rise-eyes-3-altcoins-for-high-returns-by-june.htm","Trader Who Predicted Bitcoin's 2024 Rise Eyes 3 Altcoins for High Returns by June","",""
"https://cryptonews.com/news/eu-securities-watchdog-considers-including-crypto-in-investment-products-expanding-market-access.htm","EU Securities Watchdog Considers Including Crypto in Investment Products, Expanding Market Access","Ruholamin Haqshanas","2024-05-09T10:12:13+00:00","Crypto Regulation European Union"
"https://cryptonews.com/news/bitgert-coin-price-surge-analysts-bullish-on-upward-trend.htm","Bitgert Coin Price Surge: Analysts Bullish on Upward Trend","",""
"https://cryptonews.com/news/trump-mocks-boden-memecoin-240m-market-cap.htm","Trump Mocks ‘Boden’ Memecoin’s $240M Market Cap, BODEN Token Surges 25%","Sujha Sundararajan","2024-05-09T06:05:15+00:00","Donald Trump jeo boden Meme Coins"
"https://cryptonews.com/news/tether-boosts-crypto-payments-in-eastern-europe-with-investment-in-citypay-io.htm","Tether Boosts Crypto Payments in Eastern Europe with Investment in CityPay.io","Hassan Shittu","2024-05-09T04:44:34+00:00","Tether Tether USDT"
"https://cryptonews.com/news/us-house-proposes-bill-to-ban-crypto-mixers-for-two-years.htm","US House Proposes Bill to Ban Cryptocurrency Mixers for Two Years","Hassan Shittu","2024-05-09T04:10:21+00:00","Blockchain Integrity Act Crypto mixers"
"https://cryptonews.com/news/bitcoin-price-prediction-as-1b-liquidity-fund-launched-for-hong-kong-crypto-etfs-will-asia-lead-the-next-bull-market.htm","Bitcoin Price Prediction as $1B Liquidity Fund Launched for Hong Kong Crypto ETFs – Will Asia Lead the Next Bull Market?","Arslan Butt","2024-05-08T22:58:37+00:00","Bitcoin bitcoin news"
"https://cryptonews.com/news/best-crypto-to-buy-today-may-8-ethereum-classic-tron-kaspa.htm","Best Crypto to Buy Today May 8 – Ethereum Classic, Tron, Kaspa","Joel Frank","2024-05-08T21:30:10+00:00","Best Crypto Bitcoin btc"
"https://cryptonews.com/news/shiba-inu-investors-move-to-new-ico-targeting-1000-returns.htm","Shiba Inu Investors Move to New ICO, Targeting 1000% Returns","Joel Frank","2024-05-08T21:12:23+00:00","SHIB Shiba inu"
"https://cryptonews.com/news/coincheck-targets-nasdaq-listing-in-q3.htm","Japanese Exchange Coincheck Targets Nasdaq Listing in Q3 – Crypto Adoption Rising?","Jimmy Aki","2024-05-08T20:27:27+00:00","Coincheck Exchange crypto adoption Japan"
"https://cryptonews.com/news/trump-token-soars-on-base-with-traders-eyeing-next-dog-themed-coin-for-100x-jump.htm","'Trump' Token Soars on Base, with Traders Eyeing Next Dog-Themed Coin for 100x Jump","Sam Cooling","2024-05-08T17:50:40+00:00","Base meme coin Trump TRUMP token"
"https://cryptonews.com/news/terra-luna-classic-price-prediction-as-lunc-rallies-4-despite-failed-governance-proposal-can-it-sustain-the-momentum.htm","Terra Luna Classic Price Prediction as LUNC Rallies 4% Despite Failed Governance Proposal – Can It Sustain the Momentum?","Joel Frank","2024-05-08T17:42:50+00:00","Luna LUNC Terra Luna Classic"
"https://cryptonews.com/news/solanas-sealana-seal-is-making-meme-coins-great-again-raises-300000-in-first-week.htm","Solana’s SEALANA ($SEAL) Is Making Meme Coins Great Again, Raises $300,000 in First Week","Tim Hakki","2024-05-08T17:32:25+00:00","Meme Coins sealana Solana"
"https://cryptonews.com/news/tokenized-assets-mastercard.htm","US Banks and Mastercard Test Ledger Tech for Settling Tokenized Assets – Institutional Adoption on the Rise?","Andrew Throuvalas","2024-05-08T17:30:31+00:00","Asset tokenization JPMorgan mastercard"
"https://cryptonews.com/news/last-chance-to-buy-solanas-greatest-multichain-meme-coin-dogeverse-in-17-million-presale.htm","Last Chance to Buy Solana’s Greatest Multichain Meme Coin, $DOGEVERSE, In $17 Million Presale","Tim Hakki","2024-05-08T17:15:06+00:00","Dogeverse Meme coin"
"https://cryptonews.com/news/trump-nft-buyers-dine-with-trump-as-stormy-daniels-testafies-in-trump-trial.htm","Donald Trump Set To Dine With NFT Buyers At Mar-a-Lago: Report","Julia Smith","2024-05-08T17:12:41+00:00","Bitcoin Blockchain Donald Trump NFTs"
"https://cryptonews.com/news/celestias-tia-price-falls-5-as-capital-shifts-to-upcoming-solana-meme-coin.htm","Celestia's TIA Price Falls 5%, as Capital Shifts to Upcoming Solana Meme Coin","Tim Hakki","2024-05-08T13:24:30+00:00","Celestia sealana TIA"
"https://cryptonews.com/news/sec-argues-for-injunctions-in-final-response-in-ripple-xrp-case.htm","SEC Argues for Injunctions in Final Response of Ripple XRP Case","Hassan Shittu","2024-05-08T13:00:30+00:00","Ripple SEC SEC Vs XRP"
"https://cryptonews.com/news/chaingpt-pad-launches-engines-of-fury-bringing-enhanced-web3-gaming-experiences-to-mainstream-players.htm","ChainGPT Pad launches Engines of Fury, bringing enhanced Web3 gaming experiences to mainstream players","",""
"https://cryptonews.com/news/ai-predicts-china-will-ban-high-energy-blockchains.htm","AI Predicts China Will Ban High-Energy Blockchains","Ruholamin Haqshanas","2024-05-08T11:48:38+00:00","Blockchain China Energy"
"https://cryptonews.com/news/crypto-scam-update-stolen-71m-wbtc-loot-distributed-among-multiple-wallets.htm","Crypto Scam Update: Stolen $71M WBTC Loot Distributed Among Multiple Wallets","Ruholamin Haqshanas","2024-05-08T11:02:30+00:00","Crypto hack crypto scam"
"https://cryptonews.com/news/pushds-innovative-e-commerce-model-draws-monero-zcash-for-potential-100x-returns.htm","Pushd’s Innovative E-Commerce Model Draws Monero & Zcash for Potential 100X Returns","",""
"https://cryptonews.com/news/leading-asian-crypto-info-provider-coinness-launches-english-live-feed-with-free-api-offer.htm","Leading Asian crypto info provider CoinNess launches English Live Feed with free API offer","",""
"https://cryptonews.com/news/chainalysis-launches-regional-headquarters-in-dubai.htm","Blockchain Intelligence Platform Chainalysis Launches Regional Headquarters in Dubai","Sujha Sundararajan","2024-05-08T09:59:53+00:00","Chainalysis UAE"
"https://cryptonews.com/exclusives/armani-ferrante-ceo-of-backpack-on-solana-and-web3-super-apps-ep-332.htm","Armani Ferrante, CEO of Backpack, on Solana and Web3 Super Apps | Ep. 332","Sead Fadilpašić","2024-05-08T09:42:27+00:00","NFT Solana Wallet"
"https://cryptonews.com/news/solana-ecosystem-sol-price-report-april-2024.htm","A Spring Downfall: Solana Ecosystem and SOL Price Action in April 2024","Veronika Rinecker | Verified by Hristina Yordanova Hristina Yordanova","2024-05-08T09:37:41+00:00","SOL Solana Solana Ecosystem"
"https://cryptonews.com/news/majority-of-americans-see-financial-system-as-outdated-but-remain-skeptical-of-crypto-as-solution.htm","Majority of Americans See Financial System as 'Outdated,' But Remain Skeptical of Crypto as Solution","Ruholamin Haqshanas","2024-05-08T07:35:46+00:00","Cryptocurrency Financial Services"
"https://cryptonews.com/news/starknet-boosts-blockchain-innovation-with-5m-grant-program.htm","Starknet Foundation Boosts Blockchain Innovation With $5M Grants Program","Harvey Hunter","2024-05-08T00:55:59+00:00","Blockchain Grant Starknet"
"https://cryptonews.com/news/robinhood-ceo-criticizes-regulatory-onslaught-on-crypto-us-pledges-to-challenge-sec.htm","Robinhood CEO Criticizes 'Regulatory Onslaught' on Crypto US, Pledges to Challenge SEC","Hassan Shittu","2024-05-08T00:24:10+00:00","Robinhood US SEC Wells notice"
"https://cryptonews.com/news/poloniex-hacker-funnels-3-4-million-through-tornado-cash-mixer.htm","Poloniex Hacker Reportedly Funnels $3.4 Million through Tornado Cash Mixer","Jimmy Aki","2024-05-07T23:46:04+00:00","Poloniex Hacker tornado cash"
"https://cryptonews.com/news/state-owned-german-bank-introduce-digital-bonds.htm","State-owned German Bank Set to Introduce Blockchain-Backed Digital Bonds","Jimmy Aki","2024-05-07T22:02:16+00:00","Digital Bond German Bank Kreditanstalt für Wiederaufbau"
"https://cryptonews.com/news/digital-currency-group-finds-crypto-significant-ahead-of-joe-biden-donald-trump-election.htm","Crypto Is A Key Issue For 1 in 5 Voters In The 2024 US Elections, Digital Currency Group Says","Julia Smith","2024-05-07T20:44:12+00:00","crypto 2024 Election Trump"
"https://cryptonews.com/news/crypto-experts-bulk-up-on-new-web3-utility-coin-next-big-bitcoin-challenger.htm","Crypto Experts Bulk Up on New Web3 Utility Coin – Next Big Bitcoin Challenger?","Joel Frank","2024-05-07T20:29:33+00:00","Gamblefi gamefi utility coin"
"https://cryptonews.com/news/best-crypto-to-buy-now-may-7-bitcoin-aioz-network-ethena.htm","Best Crypto to Buy Now May 7 – Bitcoin, AIOZ Network, Ethena","Joel Frank","2024-05-07T20:25:33+00:00","Best Crypto Bitcoin btc"
"https://cryptonews.com/news/colombias-bancolombia-launches-crypto-exchange-wenia-and-stablecoin-copw.htm","Colombia's Bancolombia Launches Crypto Exchange Wenia and Stablecoin COPW","Thomas Musgrave","2024-05-07T19:24:14+00:00","CEXs Colombia Stablecoin"
"https://cryptonews.com/news/worldcoin-price-rises-on-may-9-new-chatgpt-rumors-and-traders-focus-on-ai-meme-coin-for-gains.htm","Worldcoin Price Rises on May 9 New ChatGPT Rumors and Traders Focus on AI Meme Coin for Gains","Tim Hakki","2024-05-07T15:37:48+00:00","AI ChatGPT Worldcoin"
"https://cryptonews.com/news/kelexo-klxo-game-changing-presale-attracts-litecoin-ltc-ethereum-classic-etc-investors-seeking-high-returns.htm","Kelexo (KLXO) Game-Changing Presale Attracts Litecoin (LTC) & Ethereum Classic (ETC) Investors Seeking High Returns","",""
"https://cryptonews.com/news/richard-teng-says-tigran-gambaryan-and-binance-employees-offered-settlement-prior-to-binance-executives-detainment.htm","Binance CEO Claims Nigeria Demanded Secret Settlement From Now Detained Binance Executive In January","Julia Smith","2024-05-07T15:22:11+00:00","Binance Nigeria richard teng"
"https://cryptonews.com/news/ethernity-switches-to-ai-enhanced-ethereum-layer-2.htm","Ethernity Switches to AI Enhanced Ethereum Layer 2 to Prevent Counterfeit Asset Trading","Tanzeel Akhtar","2024-05-07T15:00:52+00:00","AI Ethereum NFT Platform"
"https://cryptonews.com/news/meme-coin-news-tesla-adds-doge-payments-whale-buys-10-4m-in-pepe.htm","Meme Coin News: Tesla Adds DOGE Payments, Whale Buys $10.4M in PEPE","Sead Fadilpašić","2024-05-07T12:37:10+00:00","Market Meme Coins Memecoin"
